counter,title
374,How to Get More Help For the Weka Machine Learning Workbench
375,5 Step Life-Cycle for Neural Network Models in Keras
376,How to Work Through a Regression Machine Learning Project in Weka Step-By-Step
377,How to Grid Search Hyperparameters for Deep Learning Models in Python With Keras
378,How To Work Through a Binary Classification Project in Weka Step-By-Step
379,How To Work Through a Multi-Class Classification Project in Weka
380,Text Generation With LSTM Recurrent Neural Networks in Python with Keras
381,How to Save Your Machine Learning Model and Make Predictions in Weka
382,Data Leakage in Machine Learning
383,How to Tune Machine Learning Algorithms in Weka
384,How To Compare the Performance of Machine Learning Algorithms in Weka
385,Understanding Stateful LSTM Recurrent Neural Networks in Python with Keras
386,How to Use Ensemble Machine Learning Algorithms in Weka
387,Sequence Classification with LSTM Recurrent Neural Networks in Python with Keras
388,How To Use Classification Machine Learning Algorithms in Weka
389,How To Use Regression Machine Learning Algorithms in Weka
390,Time Series Prediction with LSTM Recurrent Neural Networks in Python with Keras
391,How To Estimate A Baseline Performance For Your Machine Learning Models in Weka
392,Time Series Prediction With Deep Learning in Keras
393,How To Estimate The Performance of Machine Learning Algorithms in Weka
394,How to Use Machine Learning Algorithms in Weka
395,8 Inspirational Applications of Deep Learning
396,How to Perform Feature Selection With Machine Learning Data in Weka
397,Deep Learning Courses
398,How To Handle Missing Values In Machine Learning Data With Weka
399,How to Transform Your Machine Learning Data in Weka
400,Crash Course in Recurrent Neural Networks for Deep Learning
401,Applied Deep Learning in Python Mini-Course
402,How to Normalize and Standardize Your Machine Learning Data in Weka
403,Predict Sentiment From Movie Reviews Using Deep Learning
404,Object Recognition with Convolutional Neural Networks in the Keras Deep Learning Library
405,How to Better Understand Your Machine Learning Data in Weka
406,Image Augmentation for Deep Learning With Keras
407,Standard Machine Learning Datasets To Practice in Weka
408,Handwritten Digit Recognition using Convolutional Neural Networks in Python with Keras
409,Crash Course in Convolutional Neural Networks for Machine Learning
410,How To Load CSV Machine Learning Data in Weka
411,Using Learning Rate Schedules for Deep Learning Models in Python with Keras
412,A Tour of the Weka Machine Learning Workbench
413,Dropout Regularization in Deep Learning Models With Keras
414,Display Deep Learning Model Training History in Keras
415,How to Download and Install the Weka Machine Learning Workbench
416,How to Check-Point Deep Learning Models in Keras
417,Rapidly Accelerate Your Progress in Applied Machine Learning With Weka
418,Save and Load Your Keras Deep Learning Models
419,Your First Machine Learning Project in Python Step-By-Step
420,Regression Tutorial with the Keras Deep Learning Library in Python
421,Save and Load Machine Learning Models in Python with scikit-learn
422,Binary Classification Tutorial with the Keras Deep Learning Library
423,Automate Machine Learning Workflows with Pipelines in Python and scikit-learn
424,Ensemble Machine Learning Algorithms in Python with scikit-learn
425,Multi-Class Classification Tutorial with the Keras Deep Learning Library
426,How To Compare Machine Learning Algorithms in Python with scikit-learn
427,Use Keras Deep Learning Models with Scikit-Learn in Python
428,Spot-Check Regression Machine Learning Algorithms in Python with scikit-learn
429,Spot-Check Classification Machine Learning Algorithms in Python with scikit-learn
430,Evaluate the Performance Of Deep Learning Models in Keras
431,Metrics To Evaluate Machine Learning Algorithms in Python
432,Develop Your First Neural Network in Python With Keras Step-By-Step
433,Evaluate the Performance of Machine Learning Algorithms in Python using Resampling
434,Feature Selection For Machine Learning in Python
435,How To Build Multi-Layer Perceptron Neural Network Models with Keras
436,How To Prepare Your Data For Machine Learning in Python with Scikit-Learn
437,Crash Course On Multi-Layer Perceptron Neural Networks
438,Visualize Machine Learning Data in Python With Pandas
439,Understand Your Machine Learning Data With Descriptive Statistics in Python
440,How To Develop and Evaluate Large Deep Learning Models with Keras on Amazon Web Services
441,How To Load Machine Learning Data in Python
442,Introduction to Python Deep Learning with Keras
443,scikit-learn Cookbook Book Review
444,Introduction to Machine Learning with scikit-learn
445,Introduction to the Python Deep Learning Library TensorFlow
446,Crash Course in Python for Machine Learning Developers
447,Introduction to the Python Deep Learning Library Theano
448,Python Ecosystem for Machine Learning
449,Machine Learning Algorithms Mini-Course
450,6 Questions To Understand Any Machine Learning Algorithm
451,Boosting and AdaBoost for Machine Learning
452,Bagging and Random Forest Ensemble Algorithms for Machine Learning
453,Support Vector Machines for Machine Learning
454,Learning Vector Quantization for Machine Learning
455,K-Nearest Neighbors for Machine Learning
456,Popular Deep Learning Libraries
457,Naive Bayes Tutorial for Machine Learning
458,Naive Bayes for Machine Learning
459,Classification And Regression Trees for Machine Learning
460,Deep Learning Books
461,Linear Discriminant Analysis for Machine Learning
462,Logistic Regression Tutorial for Machine Learning
463,Logistic Regression for Machine Learning
464,Linear Regression Tutorial Using Gradient Descent for Machine Learning
465,Simple Linear Regression Tutorial for Machine Learning
466,Linear Regression for Machine Learning
467,Gradient Descent For Machine Learning
468,Overfitting and Underfitting With Machine Learning Algorithms
469,Gentle Introduction to the Bias-Variance Trade-Off in Machine Learning
470,Supervised and Unsupervised Machine Learning Algorithms
471,Parametric and Nonparametric Machine Learning Algorithms
472,How Machine Learning Algorithms Work (they learn a mapping of input to output)
473,How To Talk About Data in Machine Learning (Terminology from Statistics and Computer Science)
474,R Machine Learning Mini-Course
475,Do Not Use Random Guessing As Your Baseline Classifier
476,How To Get Started With Machine Learning in R (get results in one weekend)
477,Machine Learning Evaluation Metrics in R
478,Compare The Performance of Machine Learning Algorithms in R
479,Review of Machine Learning With R
480,Machine Learning Project Template in R
481,Save And Finalize Your Machine Learning Model in R
482,Get Your Data Ready For Machine Learning in R with Pre-Processing
483,Spot Check Machine Learning Algorithms in R (algorithms to try on your next project)
484,Machine Learning Datasets in R (10 datasets you can use right now)
485,How To Load Your Machine Learning Data Into R
486,"How to Build an Ensemble Of Machine Learning Algorithms in R (ready to use boosting, bagging and stacking)"
487,Tune Machine Learning Algorithms in R (random forest case study)
488,Your First Machine Learning Project in R Step-By-Step (tutorial and template for future projects)
489,How to Evaluate Machine Learning Algorithms with R
490,Better Understand Your Data in R Using Visualization (10 recipes you can use today)
491,Better Understand Your Data in R Using Descriptive Statistics (8 recipes you can use today)
492,Super Fast Crash Course in R (for developers)
493,Simple 3-Step Methodology To The Best Machine Learning Algorithm
494,Begin Machine Learning By Finding The Landmarks
495,How To Use R For Machine Learning
496,Use R For Machine Learning
497,Why Implement a Machine Learning Algorithm From Scratch
498,Extend Machine Learning Tools and Demonstrate Mastery
499,Build a Deep Understanding of Machine Learning Tools Using Small Targeted Projects
500,Jump-Start Using Any Machine Learning Tool With Recipes
501,Understand Any Machine Learning Tool Quickly (even if you are a beginner)
502,Map the Landscape of Machine Learning Tools
503,How To Learn Any Machine Learning Tool
504,Machine Learning Tools
505,Basic Concepts in Machine Learning
506,Useful Things To Know About Machine Learning
507,Tour of Real-World Machine Learning Problems
508,How a Beginner Used Small Projects To Get Started in Machine Learning and Compete on Kaggle
509,Philosophy Graduate to Machine Learning Practitioner (an interview with Brian Thomas)
510,How Do I Get Started In Machine Learning? (the short version)
511,Gentle Introduction to Predictive Modeling
512,"How to Use a Machine Learning Checklist to Get Accurate Predictions, Reliably (even if you are a beginner)"
513,Data Science From Scratch: Book Review
514,Find Your Machine Learning Tribe
515,Understand Machine Learning Algorithms By Implementing Them From Scratch (and tactics to get around bad code)
516,Choosing Machine Learning Algorithms: Lessons from Microsoft Azure
517,5 Techniques To Understand Machine Learning Algorithms Without the Background in Mathematics
518,Practice Machine Learning with Datasets from the UCI Machine Learning Repository
519,8 Tactics to Combat Imbalanced Classes in Your Machine Learning Dataset
520,Machine Learning for Programmers
521,Get Paid To Apply Machine Learning
522,Get Started and Make Progress in Machine Learning
523,What To Do During Machine Learning Model Runs
524,Common Pitfalls In Machine Learning Projects
525,Linear Algebra for Machine Learning
526,Machine Learning With Statistical And Causal Methods
527,How To Work Through A Problem Like A Data Scientist
528,How To Get Started In Machine Learning: A Self-Study Blueprint
529,Practical Machine Learning Books for the Holidays: A Quick Look at the New Offerings from O’Reilly
530,Use Random Forest: Testing 179 Classifiers on 121 Datasets
531,Better Naive Bayes: 12 Tips To Get The Most From The Naive Bayes Algorithm
532,How To Implement Naive Bayes From Scratch in Python
533,Lessons Learned from Building Machine Learning Systems
534,Get Your Dream Job in Machine Learning by Delivering Results
535,Assessing and Comparing Classifier Performance with ROC Curves
536,Evaluate Yourself As a Data Scientist and Use The Results To Build Amazing Data Science Teams
537,Understand Your Problem and Get Better Results Using Exploratory Data Analysis
538,Data Management Matters And Why You Need To Take It Seriously
539,How to Become a Data Scientist
540,Crash Course in Statistics for Machine Learning
541,Why Aren’t My Results As Good As I Thought? You’re Probably Overfitting
542,"Machine Learning Q&A: Concept Drift, Better Results and Learning Faster"
543,Hello World of Applied Machine Learning
544,How To Get Baseline Results And Why They Matter
545,Take Control By Creating Targeted Lists of Machine Learning Algorithms
546,Don’t Start with Open-Source Code When Implementing Machine Learning Algorithms
547,How To Investigate Machine Learning Algorithm Behavior
548,How to Research a Machine Learning Algorithm
549,Model Selection Tips From Competitive Machine Learning
550,How to Study Machine Learning Algorithms
551,5 Machine Learning Areas You Should Be Cultivating
552,16 Options To Get Started and Make Progress in Machine Learning and Data Science
553,Building a Production Machine Learning Infrastructure
554,An Introduction to Feature Selection
555,Discover the Methodology and Mindset of a Kaggle Master: An Interview with Diogo Ferreira
556,How to Build an Intuition for Machine Learning Algorithms
557,A Data-Driven Approach to Choosing Machine Learning Algorithms
558,"Discover Feature Engineering, How to Engineer Features and How to Get Good at It"
559,Compare Models And Select The Best Using The Caret R Package
560,Feature Selection with the Caret R Package
561,Tuning Machine Learning Models Using the Caret R Package
562,Data Visualization with the Caret R package
563,Caret R Package for Applied Predictive Modeling
564,Tutorial To Implement k-Nearest Neighbors in Python From Scratch
565,Benefits of Implementing Machine Learning Algorithms From Scratch
566,Review of Applied Predictive Modeling
567,How To Get Started With Machine Learning Algorithms in R
568,How To Estimate Model Accuracy in R Using The Caret Package
569,Machine Learning Newsletters
570,Convex Optimization in R
571,Non-Linear Classification in R with Decision Trees
572,What is R
573,5 Benefits of Competitive Machine Learning
574,Master Kaggle By Competing Consistently
575,Going Beyond Predictions
576,How to Kick Ass in Competitive Machine Learning
577,How To Get Better At Machine Learning
578,Non-Linear Classification in R
579,Linear Classification in R
580,Clever Application Of A Predictive Model
581,Improve Model Accuracy with Data Pre-Processing
582,Model Prediction Accuracy Versus Interpretation in Machine Learning
583,Non-Linear Regression in R with Decision Trees
584,Non-Linear Regression in R
585,Penalized Regression in R
586,Linear Regression in R
587,Applied Machine Learning Lessons from A Case Study of Passenger Survival Prediction
588,Java Machine Learning
589,How to Tune Algorithm Parameters with Scikit-Learn
590,Feature Selection in Python with Scikit-Learn
591,Rescaling Data for Machine Learning in Python with Scikit-Learn
592,How to Load Data in Python with Scikit-Learn
593,Data Science Screencasts: A Data Origami Review
594,Machine Learning is Kaggle Competitions
595,Machine Learning Communities
596,Books for Machine Learning with R
597,Practical Advice for Getting Started in Machine Learning
598,Quick and Dirty Data Analysis with Pandas
599,Prepare Data for Machine Learning in Python with Pandas
600,Machine Learning Algorithm Recipes in scikit-learn
601,The Best Machine Learning Algorithm
602,Computer Hardware for Machine Learning
603,How I Got Started In Machine Learning
604,Machine Learning for Money
605,Work on Machine Learning Problems That Matter To You
606,Build a Machine Learning Portfolio
607,What Is Holding You Back From Your Machine Learning Goals?
608,The Missing Roadmap to Self-Study Machine Learning
609,Data Cleaning: Turn Messy Data into Tidy Data
610,The Data Analytics Handbook: Researchers and Academics Review
611,Machine Learning with Quantum Computers
612,Machine Learning that Matters
613,Bootstrapping Machine Learning: Book Review
614,Lessons for Machine Learning from Econometrics
615,"Using OpenCV, Python and Template Matching to play “Where’s Waldo?”"
616,The Data Analytics Handbook: CEOs and Managers
617,How to Layout and Manage Your Machine Learning Project
618,Best Programming Language for Machine Learning
619,The Seductive Trap of Black-Box Machine Learning
620,IPython from the shell to a book with a single tool with Fernando Perez
621,How to Get Started with Machine Learning in Python
622,The Data Analytics Handbook: Data Analysts and Data Scientists
623,Bootstrapping Machine Learning: An Upcoming Book on Prediction APIs
624,A Gentle Introduction to Scikit-Learn: A Python Machine Learning Library
625,Python Machine Learning Books
626,Case Study: Predicting the Onset of Diabetes Within Five Years (part 3 of 3)
627,Introduction to Bayesian Networks with Jhonatan de Souza Oliveira
628,BigML Tutorial: Develop Your First Decision Tree and Make Predictions
629,Case Study: Predicting the Onset of Diabetes Within Five Years (part 2 of 3)
630,Project Spotlight: Face Recognition with Shashank Singh
631,BigML Review: Discover the Clever Features in This Machine Learning as a Service Platform
632,Case Study: Predicting the Onset of Diabetes Within Five Years (part 1 of 3)
633,5 Steps to Thinking Like a Designer in Machine Learning
634,Machine Learning Tips from a World Class Practitioner: Phil Brierley
635,Classification Accuracy is Not Enough: More Performance Measures You Can Use
636,Project Spotlight: Event Recommendation in Python with Artem Yankov
637,Market Basket Analysis with Association Rule Learning
638,Project Spotlight: Stack Exchange Clustering using Mahout with Konstantin Slisenko
639,Feature Selection to Improve Accuracy and Decrease Training Time
640,"Biggest Mistake I Made When Starting Machine Learning, And How To Avoid It"
641,Template for Working through Machine Learning Problems in Weka
642,"A Simple Intuition for Overfitting, or Why Testing on Training Data is a Bad Idea"
643,4-Steps to Get Started in Machine Learning: The Top-Down Strategy for Beginners to Start and Practice
644,"Improve Machine Learning Results with Boosting, Bagging and Blending Ensemble Methods in Weka"
645,How to Tune a Machine Learning Algorithm in Weka
646,Quick and Dirty Data Analysis for your Machine Learning Problem
647,Design and Run your First Experiment in Weka
648,How To Choose The Right Test Options When Evaluating Machine Learning Algorithms
649,How to Run Your First Classifier in Weka
650,Applied Machine Learning Process
651,Why you should be Spot-Checking Algorithms on your Machine Learning Problems
652,What is the Weka Machine Learning Workbench
653,How to get the most from Machine Learning Books and Courses
654,5 Mistakes Programmers Make when Starting in Machine Learning
655,6 Practical Books for Beginning Machine Learning
656,How to Implement a Machine Learning Algorithm
657,Applied Machine Learning is a Meritocracy
658,What if I’m Not a Good Programmer
659,What if I Don’t Have a Degree
660,What If I Am Not Good At Mathematics
661,How to Learn a Machine Learning Algorithm
662,Hands on Big Data by Peter Norvig
663,Reproducible Machine Learning Results By Default
664,What is Data Mining and KDD
665,4 Self-Study Machine Learning Projects
666,How to Use Machine Learning Results
667,How to Identify Outliers in your Data
668,How to Improve Machine Learning Results
669,How to Evaluate Machine Learning Algorithms
670,How to Prepare Data For Machine Learning
671,How to Define Your Machine Learning Problem
672,"Data, Learning and Modeling"
673,Where Does Machine Learning Fit In?
674,Programmers Should Get Into Machine Learning
675,Machine Learning is Popular Right Now
676,Machine Learning is Fascinating
677,Machine Learning Matters
678,Self-Study Guide to Machine Learning
679,Why Get Into Machine Learning?
680,Programmers Can Get Into Machine Learning
681,Best Machine Learning Resources for Getting Started
682,A Tour of Machine Learning Algorithms
683,Practical Machine Learning Problems
684,What is Machine Learning?
