counter,title
1,A Gentle Introduction to Early Stopping to Avoid Overtraining Deep Learning Neural Network Models
2,How to Reduce Overfitting With Dropout Regularization in Keras
3,A Gentle Introduction to Dropout for Regularizing Deep Neural Networks
4,How to Reduce Generalization Error in Deep Neural Networks With Activity Regularization in Keras
5,Activation Regularization for Reducing Generalization Error in Deep Learning Neural Networks
6,How to Reduce Overfitting in Deep Neural Networks Using Weight Constraints in Keras
7,A Gentle Introduction to Weight Constraints to Reduce Generalization Error in Deep Learning
8,How to Reduce Overfitting of a Deep Learning Model with Weight Regularization
9,Use Weight Regularization to Reduce Overfitting of Deep Learning Models
10,How to Grid Search Deep Learning Models for Time Series Forecasting
11,How to Develop LSTM Models for Time Series Forecasting
12,How to Develop Convolutional Neural Network Models for Time Series Forecasting
13,How to Develop Multilayer Perceptron Models for Time Series Forecasting
14,How to Use the TimeseriesGenerator for Time Series Forecasting in Keras
15,A Gentle Introduction to LSTM Autoencoders
16,LSTM Model Architecture for Rare Event Time Series Forecasting
17,Results From Comparing Classical and Machine Learning Methods for Time Series Forecasting
18,How to Develop Deep Learning Models for Univariate Time Series Forecasting
19,How to Grid Search Naive Methods for Univariate Time Series Forecasting
20,How to Grid Search SARIMA Model Hyperparameters for Time Series Forecasting in Python
21,How to Grid Search Triple Exponential Smoothing for Time Series Forecasting in Python
22,How to Develop Machine Learning Models for Multivariate Multi-Step Air Pollution Time Series Forecasting
23,How to Develop Autoregressive Forecasting Models for Multi-Step Air Pollution Time Series Forecasting
24,How to Develop Baseline Forecasts for Multi-Site Multivariate Air Pollution Time Series Forecasting
25,"How to Load, Visualize, and Explore a Complex Multivariate Multistep Time Series Forecasting Dataset"
26,How to Develop LSTM Models for Multi-Step Time Series Forecasting of Household Power Consumption
27,How to Develop Convolutional Neural Networks for Multi-Step Time Series Forecasting
28,Multi-step Time Series Forecasting with Machine Learning for Household Electricity Consumption
29,How to Develop an Autoregression Forecast Model for Household Electricity Consumption
30,How to Develop and Evaluate Naive Methods for Forecasting Household Electricity Consumption
31,How to Load and Explore Household Electricity Usage Data
32,Deep Learning Models for Human Activity Recognition
33,How to Develop RNN Models for Human Activity Recognition Time Series Classification
34,How to Develop 1D Convolutional Neural Network Models for Human Activity Recognition
35,How to Evaluate Machine Learning Algorithms for Human Activity Recognition
36,How to Model Human Activity From Smartphone Data
37,How to Develop a Reusable Framework to Spot-Check Algorithms in Python
38,A Gentle Introduction to a Standard Human Activity Recognition Problem
39,Indoor Movement Time Series Classification with Machine Learning Algorithms
40,How to Develop a Probabilistic Forecasting Model to Predict Air Pollution Days
41,A Gentle Introduction to Probability Scoring Methods in Python
42,How to Get Started with Deep Learning for Time Series Forecasting (7-Day Mini-Course)
43,How and When to Use a Calibrated Classification Model with scikit-learn
44,How and When to Use ROC Curves and Precision-Recall Curves for Classification in Python
45,How to Predict Room Occupancy Based on Environmental Factors
46,How to Predict Whether a Persons Eyes are Open or Closed Using Brain Waves
47,How to Model Volatility with ARCH and GARCH for Time Series Forecasting in Python
48,4 Common Machine Learning Data Transforms for Time Series Forecasting
49,A Gentle Introduction to Exponential Smoothing for Time Series Forecasting in Python
50,A Gentle Introduction to SARIMA for Time Series Forecasting in Python
51,15 Statistical Hypothesis Tests in Python (Cheat Sheet)
52,How to Reduce Variance in a Final Machine Learning Model
53,How to Develop a Skillful Machine Learning Time Series Forecasting Model
54,Taxonomy of Time Series Forecasting Problems
55,11 Classical Time Series Forecasting Methods in Python (Cheat Sheet)
56,Statistics for Machine Learning (7-Day Mini-Course)
57,Why Initialize a Neural Network with Random Weights?
58,How to Code the Student’s t-Test from Scratch in Python
59,How to Configure the Number of Layers and Nodes in a Neural Network
60,How to Calculate McNemar’s Test to Compare Two Machine Learning Classifiers
61,"When to Use MLP, CNN, and RNN Neural Networks"
62,What is the Difference Between a Batch and an Epoch in a Neural Network?
63,The Role of Randomization to Address Confounding Variables in Machine Learning
64,All of Statistics for Machine Learning
65,A Gentle Introduction to Statistical Power and Power Analysis in Python
66,A Gentle Introduction to Effect Size Measures in Python
67,How to Calculate Nonparametric Rank Correlation in Python
68,Statistics in Plain English for Machine Learning
69,How to Generate Random Numbers in Python
70,Statistics for Evaluating Machine Learning Models
71,The Close Relationship Between Applied Statistics and Machine Learning
72,What is Statistics (and why is it important in machine learning)?
73,10 Examples of How to Use Statistical Methods in a Machine Learning Project
74,Controlled Experiments in Machine Learning
75,Statistical Significance Tests for Comparing Machine Learning Algorithms
76,A Gentle Introduction to the Chi-Squared Test for Machine Learning
77,How to Calculate the 5-Number Summary for Your Data in Python
78,A Gentle Introduction to Statistical Sampling and Resampling
79,Critical Values for Statistical Hypothesis Testing and How to Calculate Them in Python
80,A Gentle Introduction to Statistical Data Distributions
81,A Gentle Introduction to Data Visualization Methods in Python
82,A Gentle Introduction to Estimation Statistics for Machine Learning
83,A Gentle Introduction to Statistical Tolerance Intervals in Machine Learning
84,Prediction Intervals for Machine Learning
85,Confidence Intervals for Machine Learning
86,A Gentle Introduction to the Bootstrap Method
87,A Gentle Introduction to k-fold Cross-Validation
88,How to Transform Data to Better Fit The Normal Distribution
89,How to Use Parametric Statistical Significance Tests in Python
90,Introduction to Nonparametric Statistical Significance Tests in Python
91,A Gentle Introduction to Statistical Hypothesis Tests
92,A Gentle Introduction to Normality Tests in Python
93,A Gentle Introduction to Nonparametric Statistics
94,Statistics Books for Machine Learning
95,A Gentle Introduction to the Central Limit Theorem for Machine Learning
96,A Gentle Introduction to the Law of Large Numbers in Machine Learning
97,A Gentle Introduction to Calculating Normal Summary Statistics
98,How to Use Correlation to Understand the Relationship Between Variables
99,How to Use Statistics to Identify Outliers in Data
100,Introduction to Random Number Generators for Machine Learning in Python
101,How To Know if Your Machine Learning Model Has Good Performance
102,The Model Performance Mismatch Problem (and what to do about it)
103,How to Get the Most From Your Machine Learning Data
104,Analytical vs Numerical Solutions in Machine Learning
105,Machine Learning Development Environment
106,How to Make Predictions with Keras
107,How to Make Predictions with scikit-learn
108,"So, You are Working on a Machine Learning Problem…"
109,How to Think About Machine Learning
110,"Start With Gradient Boosting, Results from Comparing 13 Algorithms on 165 Datasets"
111,You’re Doing it Wrong. Why Machine Learning Does Not Have to Be So Hard
112,Basics of Mathematical Notation for Machine Learning
113,Linear Algebra for Machine Learning (7-Day Mini-Course)
114,Computational Linear Algebra for Coders Review
115,Linear Algebra for Deep Learning
116,A Gentle Introduction to Sparse Matrices for Machine Learning
117,A Gentle Introduction to Broadcasting with NumPy Arrays
118,10 Examples of Linear Algebra in Machine Learning
119,No Bullshit Guide To Linear Algebra Review
120,How to Solve Linear Regression Using Linear Algebra
121,How to Calculate the Principal Component Analysis from Scratch in Python
122,"A Gentle Introduction to Expected Value, Variance, and Covariance with NumPy"
123,A Gentle Introduction to Singular-Value Decomposition for Machine Learning
124,Linear Algebra Cheat Sheet for Machine Learning
125,Top Resources for Learning Linear Algebra for Machine Learning
126,"Gentle Introduction to Eigendecomposition, Eigenvalues, and Eigenvectors for Machine Learning"
127,A Gentle Introduction to Matrix Factorization for Machine Learning
128,A Gentle Introduction to Tensors for Machine Learning with NumPy
129,A Gentle Introduction to Matrix Operations for Machine Learning
130,Introduction to Matrix Types in Linear Algebra for Machine Learning
131,Introduction to Matrices and Matrix Arithmetic for Machine Learning
132,Gentle Introduction to Vector Norms in Machine Learning
133,A Gentle Introduction to Vectors for Machine Learning
134,A Gentle Introduction to N-Dimensional Arrays in Python with NumPy
135,5 Reasons to Learn Linear Algebra for Machine Learning
136,A Gentle Introduction to Linear Algebra
137,Why Do Machine Learning Algorithms Work on Data That They Have Not Seen Before?
138,How to Run Deep Learning Experiments on a Linux Server
139,"A Standard Multivariate, Multi-Step, and Multi-Site Time Series Forecasting Problem"
140,How to Install XGBoost for Python on macOS
141,How to Generate Test Datasets in Python with scikit-learn
142,How to Develop an N-gram Multichannel Convolutional Neural Network for Sentiment Analysis
143,How to Develop a Neural Machine Translation System from Scratch
144,How to Prepare a French-to-English Dataset for Machine Translation
145,How to Implement a Beam Search Decoder for Natural Language Processing
146,How to Configure an Encoder-Decoder Model for Neural Machine Translation
147,Encoder-Decoder Recurrent Neural Network Models for Neural Machine Translation
148,A Gentle Introduction to Neural Machine Translation
149,Caption Generation with the Inject and Merge Architectures for the Encoder-Decoder Model
150,A Gentle Introduction to Applied Machine Learning as a Search Problem
151,Why Applied Machine Learning Is Hard
152,A Gentle Introduction to Transfer Learning for Deep Learning
153,A Gentle Introduction to Exploding Gradients in Neural Networks
154,A Gentle Introduction to Concept Drift in Machine Learning
155,How to Visualize a Deep Learning Neural Network Model in Keras
156,Difference Between Classification and Regression in Machine Learning
157,Encoder-Decoder Models for Text Summarization in Keras
158,What is Teacher Forcing for Recurrent Neural Networks?
159,How to Prepare News Articles for Text Summarization
160,Encoder-Decoder Deep Learning Models for Text Summarization
161,A Gentle Introduction to Text Summarization
162,How to Develop a Deep Learning Photo Caption Generator from Scratch
163,How to Use Small Experiments to Develop a Caption Generation Model in Keras
164,A Gentle Introduction to Deep Learning Caption Generation Models
165,A Gentle Introduction to Calculating the BLEU Score for Text in Python
166,How to Prepare Univariate Time Series Data for Long Short-Term Memory Networks
167,How to Prepare a Photo Caption Dataset for Training a Deep Learning Model
168,How to Automatically Generate Textual Descriptions for Photographs with Deep Learning
169,How to Develop a Word-Level Neural Language Model and Use it to Generate Text
170,How to Use The Pre-Trained VGG Model to Classify Objects in Photographs
171,How to Get Started with Deep Learning for Natural Language Processing (7-Day Mini-Course)
172,How to Develop a Character-Based Neural Language Model in Keras
173,How to Develop Word-Based Neural Language Models in Python with Keras
174,How to Develop an Encoder-Decoder Model for Sequence-to-Sequence Prediction in Keras
175,Gentle Introduction to Statistical Language Modeling and Neural Language Models
176,Gentle Introduction to Global Attention for Encoder-Decoder Recurrent Neural Networks
177,How to Develop a Word Embedding Model for Predicting Movie Review Sentiment
178,How to Use the Keras Functional API for Deep Learning
179,How to Define an Encoder-Decoder Sequence-to-Sequence Model for Neural Machine Translation in Keras
180,"How to Index, Slice and Reshape NumPy Arrays for Machine Learning in Python"
181,Understand the Difference Between Return Sequences and Return States for LSTMs in Keras
182,Best Practices for Document Classification with Deep Learning
183,How to Develop a Deep Learning Bag-of-Words Model for Predicting Movie Review Sentiment
184,Implementation Patterns for the Encoder-Decoder RNN Architecture with Attention
185,How to Clean Text for Machine Learning with Python
186,How to Develop an Encoder-Decoder Model with Attention for Sequence-to-Sequence Prediction in Keras
187,How to Prepare Movie Review Data for Sentiment Analysis
188,How Does Attention Work in Encoder-Decoder Recurrent Neural Networks
189,What Are Word Embeddings for Text?
190,A Gentle Introduction to the Bag-of-Words Model
191,How to Develop Word Embeddings in Python with Gensim
192,How to Use Word Embedding Layers for Deep Learning with Keras
193,How to Prepare Text Data for Deep Learning with Keras
194,How to Prepare Text Data for Machine Learning with scikit-learn
195,Datasets for Natural Language Processing
196,Promise of Deep Learning for Natural Language Processing
197,What Is Natural Language Processing?
198,7 Applications of Deep Learning for Natural Language Processing
199,Gentle Introduction to Transduction in Machine Learning
200,Primer on Neural Network Models for Natural Language Processing
201,Oxford Course on Deep Learning for Natural Language Processing
202,Review of Stanford Course on Deep Learning for Natural Language Processing
203,Top Books on Natural Language Processing
204,A Gentle Introduction to RNN Unrolling
205,Making Predictions with Sequences
206,How to Diagnose Overfitting and Underfitting of LSTM Models
207,How to Reshape Input Data for Long Short-Term Memory Networks in Keras
208,How to Make Predictions with Long Short-Term Memory Models in Keras
209,Gentle Introduction to Generative Long Short-Term Memory Networks
210,Encoder-Decoder Long Short-Term Memory Networks
211,CNN Long Short-Term Memory Networks
212,Stacked Long Short-Term Memory Networks
213,Mini-Course on Long Short-Term Memory Recurrent Neural Networks with Keras
214,Multivariate Time Series Forecasting with LSTMs in Keras
215,Get the Most out of LSTMs on Your Sequence Prediction Problem
216,How to Use Metrics for Deep Learning with Keras in Python
217,10 Command Line Recipes for Deep Learning on Amazon Web Services
218,How to Plan and Run Machine Learning Experiments Systematically
219,9 Ways to Get Help with Deep Learning in Keras
220,How to Get Good Results Fast with Deep Learning for Time Series Forecasting
221,Why One-Hot Encode Data in Machine Learning?
222,What is the Difference Between a Parameter and a Hyperparameter?
223,How Much Training Data is Required for Machine Learning?
224,A Gentle Introduction to Mini-Batch Gradient Descent and How to Configure Batch Size
225,5 Examples of Simple Sequence Prediction Problems for Learning LSTM Recurrent Neural Networks
226,Gentle Introduction to Models for Sequence Prediction with Recurrent Neural Networks
227,What is the Difference Between Test and Validation Datasets?
228,How to One Hot Encode Sequence Data in Python
229,How to Remove Trends and Seasonality with a Difference Transform in Python
230,How to Scale Data for Long Short-Term Memory Networks in Python
231,A Tour of Recurrent Neural Network Algorithms for Deep Learning
232,Gentle Introduction to the Adam Optimization Algorithm for Deep Learning
233,Attention in Long Short-Term Memory Recurrent Neural Networks
234,How to Prepare Sequence Prediction for Truncated Backpropagation Through Time in Keras
235,How to Handle Very Long Sequences with Long Short-Term Memory Recurrent Neural Networks
236,A Gentle Introduction to Backpropagation Through Time
237,How to Handle Missing Timesteps in Sequence Prediction Problems with Python
238,Data Preparation for Variable Length Input Sequences
239,How to Develop a Bidirectional LSTM For Sequence Classification in Python with Keras
240,How to Get Reproducible Results with Keras
241,How to use an Encoder-Decoder LSTM to Echo Sequences of Random Integers
242,How to Learn to Echo Random Integers with Long Short-Term Memory Recurrent Neural Networks
243,The 5 Step Life-Cycle for Long Short-Term Memory Models in Keras
244,How to Calculate Bootstrap Confidence Intervals For Machine Learning Results in Python
245,How to Report Classifier Performance with Confidence Intervals
246,How to Evaluate the Skill of Deep Learning Models
247,7 Ways to Handle Large Data Files for Machine Learning
248,On the Suitability of Long Short-Term Memory Networks for Time Series Forecasting
249,A Gentle Introduction to Long Short-Term Memory Networks by the Experts
250,The Promise of Recurrent Neural Networks for Time Series Forecasting
251,Learn to Add Numbers with an Encoder-Decoder LSTM Recurrent Neural Network
252,How to Use the TimeDistributed Layer for Long Short-Term Memory Networks in Python
253,How to use Different Batch Sizes when Training and Predicting with LSTMs
254,Demonstration of Memory with a Long Short-Term Memory Network in Python
255,Multi-step Time Series Forecasting with Long Short-Term Memory Networks in Python
256,How to Convert a Time Series to a Supervised Learning Problem in Python
257,How to Use Weight Regularization with LSTM Networks for Time Series Forecasting
258,How to Use Statistical Significance Tests to Interpret Machine Learning Results
259,Estimate the Number of Experiment Repeats for Stochastic Machine Learning Algorithms
260,How to Use Dropout with LSTM Networks for Time Series Forecasting
261,Exploratory Configuration of a Multilayer Perceptron Network for Time Series Forecasting
262,Instability of Online Learning for Stateful LSTM for Time Series Forecasting
263,Stateful and Stateless LSTM for Time Series Forecasting with Python
264,How to Use Features in LSTM Networks for Time Series Forecasting
265,How to Use Timesteps in LSTM Networks for Time Series Forecasting
266,How to Update LSTM Networks During Training for Time Series Forecasting
267,How to Tune LSTM Hyperparameters with Keras for Time Series Forecasting
268,How to Seed State for LSTMs for Time Series Forecasting in Python
269,Time Series Forecasting with the Long Short-Term Memory Network in Python
270,Seasonal Persistence Forecasting With Python
271,How to Tune ARIMA Parameters in Python
272,Simple Time Series Forecasting Models to Test So That You Don’t Fool Yourself
273,Feature Selection for Time Series Forecasting with Python
274,Sensitivity Analysis of History Size to Forecast Skill with ARIMA in Python
275,How to Make Out-of-Sample Forecasts with ARIMA in Python
276,Time Series Forecasting with Python 7-Day Mini-Course
277,How to Handle Missing Data with Python
278,How to Train a Final Machine Learning Model
279,How to Install a Python 3 Environment on Mac OS X for Machine Learning and Deep Learning
280,How to Setup a Python Environment for Machine Learning and Deep Learning with Anaconda
281,How to Get Started with Kaggle
282,4 Strategies for Multi-Step Time Series Forecasting
283,White Noise Time Series with Python
284,Python Environment for Time Series Forecasting
285,10 Challenging Machine Learning Time Series Forecasting Problems
286,How to Create a Linux Virtual Machine For Machine Learning Development With Python 3
287,How to Save an ARIMA Time Series Forecasting Model in Python
288,How to Difference a Time Series Dataset with Python
289,Time Series Forecast Study with Python: Monthly Sales of French Champagne
290,How Álvaro Lemos got a Machine Learning Internship on a Data Science Team
291,Time Series Forecast Case Study with Python: Annual Water Usage in Baltimore
292,Time Series Forecast Case Study with Python: Monthly Armed Robberies in Boston
293,Understand Time Series Forecast Uncertainty Using Confidence Intervals with Python
294,How to Make Manual Predictions for ARIMA Models with Python
295,A Gentle Introduction to Autocorrelation and Partial Autocorrelation
296,How to Work Through a Time Series Forecast Project
297,Time Series Forecasting Performance Measures With Python
298,How to Decompose Time Series Data into Trend and Seasonality
299,How to Make Predictions for Time Series Forecasting with Python
300,How to Use Power Transforms for Time Series Forecast Data with Python
301,How to Reframe Your Time Series Forecasting Problem
302,A Gentle Introduction to the Random Walk for Times Series Forecasting with Python
303,How to Grid Search ARIMA Model Hyperparameters with Python
304,Machine Learning Books
305,A Gentle Introduction to the Box-Jenkins Method for Time Series Forecasting
306,How to Model Residual Errors to Correct Time Series Forecasts with Python
307,How to Create an ARIMA Model for Time Series Forecasting in Python
308,How to Visualize Time Series Residual Forecast Errors with Python
309,Time Series Data Visualization with Python
310,Autoregression Models for Time Series Forecasting With Python
311,How to Check if Time Series Data is Stationary with Python
312,"Moving Average Smoothing for Data Preparation, Feature Engineering, and Time Series Forecasting with Python"
313,How to Make Baseline Predictions for Time Series Forecasting with Python
314,How to Identify and Remove Seasonality from Time Series Data with Python
315,How to Use and Remove Trend Information from Time Series Data in Python
316,How To Backtest Machine Learning Models for Time Series Forecasting
317,How To Resample and Interpolate Your Time Series Data With Python
318,Basic Feature Engineering With Time Series Data in Python
319,How to Normalize and Standardize Time Series Data in Python
320,How to Load and Explore Time Series Data in Python
321,How to Go From Working in a Bank To Hired as Senior Data Scientist at Target
322,Time Series Forecasting as Supervised Learning
323,What Is Time Series Forecasting?
324,7 Time Series Datasets for Machine Learning
325,5 Top Machine Learning Podcasts
326,10 Standard Datasets for Practicing Applied Machine Learning
327,Machine Learning Performance Improvement Cheat Sheet
328,Top Books on Time Series Forecasting With R
329,What is a Confusion Matrix in Machine Learning
330,How to Implement Stacked Generalization (Stacking) From Scratch With Python
331,How to Implement Random Forest From Scratch in Python
332,How to Implement Bagging From Scratch With Python
333,How To Implement The Decision Tree Algorithm From Scratch In Python
334,How to Implement the Backpropagation Algorithm From Scratch In Python
335,How To Implement Learning Vector Quantization From Scratch With Python
336,How To Implement The Perceptron Algorithm From Scratch In Python
337,Python is the Growing Platform for Applied Machine Learning
338,How To Implement Logistic Regression With Stochastic Gradient Descent From Scratch With Python
339,How to Implement Linear Regression With Stochastic Gradient Descent From Scratch With Python
340,How To Implement Simple Linear Regression From Scratch With Python
341,How To Create an Algorithm Test Harness From Scratch With Python
342,How To Implement Baseline Machine Learning Algorithms From Scratch With Python
343,How To Implement Machine Learning Algorithm Performance Metrics From Scratch With Python
344,How to Implement Resampling Methods From Scratch In Python
345,How to Scale Machine Learning Data From Scratch With Python
346,How to Load Machine Learning Data From Scratch In Python
347,The Machine Learning Mastery Method
348,Machine Learning In A Year
349,Stop Coding Machine Learning Algorithms From Scratch
350,How Beginners Get It Wrong In Machine Learning
351,Deploy Your Predictive Model To Production
352,Embrace Randomness in Machine Learning
353,Python Machine Learning Mini-Course
354,7 Step Mini-Course to Get Started with XGBoost in Python
355,How To Improve Deep Learning Performance
356,Stochastic Gradient Boosting with XGBoost and scikit-learn in Python
357,Tune Learning Rate for Gradient Boosting with XGBoost in Python
358,What You Know About Deep Learning Is A Lie
359,How to Train XGBoost Models in the Cloud with Amazon Web Services
360,How to Configure the Gradient Boosting Algorithm
361,A Gentle Introduction to the Gradient Boosting Algorithm for Machine Learning
362,How to Tune the Number and Size of Decision Trees with XGBoost in Python
363,How to Best Tune Multithreading Support for XGBoost in Python
364,Avoid Overfitting By Early Stopping With XGBoost In Python
365,Feature Importance and Feature Selection With XGBoost in Python
366,How to Visualize Gradient Boosting Decision Trees With XGBoost in Python
367,How to Evaluate Gradient Boosting Models with XGBoost in Python
368,How to Save Gradient Boosting Models with XGBoost in Python
369,Data Preparation for Gradient Boosting with XGBoost in Python
370,How to Develop Your First XGBoost Model in Python with scikit-learn
371,A Gentle Introduction to XGBoost for Applied Machine Learning
372,What is Deep Learning?
373,Weka Machine Learning Mini-Course
